{
  "id": "faq-6",
  "question": "Do you offer discounts for non-profits or annual pre-payments?",
  "answer": "Yes, we offer a 20% discount on all prepaid annual subscriptions. Eligible non-profit organizations and open-source projects receive an additional 15% discount across all tiers.",
  "category": "Billing",
  "featured": true
}
