{
  "id": "faq-1",
  "question": "How does NexFlow's 14-day free trial work?",
  "answer": "You get immediate access to the full feature set of our Growth Pro tier, including 300+ native connectors, SAML SSO, and priority execution queues. No credit card is required to sign up.",
  "category": "Billing",
  "featured": true
}
