{
  "id": "faq-3",
  "question": "Can NexFlow be deployed in our private cloud (AWS VPC / GCP Project)?",
  "answer": "Yes. Our Custom Enterprise tier includes single-tenant deployments via Terraform modules or Helm charts into your AWS, Azure, or GCP private subnet with complete data residency controls.",
  "category": "Deployment",
  "featured": true
}
